{
  "schemaVersion": "1.0.0",
  "catalogId": "generated-demo-v1",
  "description": "Original synthesized clips for local engineering tests. Mood values are design proxies, not human emotion annotations.",
  "tracks": [
    {"id":"night-rain","title":"Night Rain","artist":"Mood Drift Lab","genre":"ambient","bpm":58,"keyMidi":48,"mode":"minor","mood":{"valence":0.18,"arousal":0.16,"provenance":"design-proxy"},"audio":{"path":"audio/generated/night-rain.wav","source":"project-generated","rights":"project-original-demo","durationSeconds":12},"attribution":"Synthesized for Mood Drift Music by the project generator."},
    {"id":"soft-shadow","title":"Soft Shadow","artist":"Mood Drift Lab","genre":"ambient","bpm":62,"keyMidi":50,"mode":"minor","mood":{"valence":0.27,"arousal":0.25,"provenance":"design-proxy"},"audio":{"path":"audio/generated/soft-shadow.wav","source":"project-generated","rights":"project-original-demo","durationSeconds":12},"attribution":"Synthesized for Mood Drift Music by the project generator."},
    {"id":"dusk-window","title":"Dusk Window","artist":"Mood Drift Lab","genre":"ambient","bpm":70,"keyMidi":53,"mode":"minor","mood":{"valence":0.38,"arousal":0.34,"provenance":"design-proxy"},"audio":{"path":"audio/generated/dusk-window.wav","source":"project-generated","rights":"project-original-demo","durationSeconds":12},"attribution":"Synthesized for Mood Drift Music by the project generator."},
    {"id":"clear-water","title":"Clear Water","artist":"Mood Drift Lab","genre":"ambient","bpm":66,"keyMidi":55,"mode":"major","mood":{"valence":0.64,"arousal":0.18,"provenance":"design-proxy"},"audio":{"path":"audio/generated/clear-water.wav","source":"project-generated","rights":"project-original-demo","durationSeconds":12},"attribution":"Synthesized for Mood Drift Music by the project generator."},
    {"id":"morning-light","title":"Morning Light","artist":"Mood Drift Lab","genre":"ambient","bpm":76,"keyMidi":57,"mode":"major","mood":{"valence":0.76,"arousal":0.32,"provenance":"design-proxy"},"audio":{"path":"audio/generated/morning-light.wav","source":"project-generated","rights":"project-original-demo","durationSeconds":12},"attribution":"Synthesized for Mood Drift Music by the project generator."},
    {"id":"open-sky","title":"Open Sky","artist":"Mood Drift Lab","genre":"ambient","bpm":82,"keyMidi":60,"mode":"major","mood":{"valence":0.86,"arousal":0.44,"provenance":"design-proxy"},"audio":{"path":"audio/generated/open-sky.wav","source":"project-generated","rights":"project-original-demo","durationSeconds":12},"attribution":"Synthesized for Mood Drift Music by the project generator."},
    {"id":"restless-city","title":"Restless City","artist":"Mood Drift Lab","genre":"pulse","bpm":124,"keyMidi":45,"mode":"minor","mood":{"valence":0.20,"arousal":0.78,"provenance":"design-proxy"},"audio":{"path":"audio/generated/restless-city.wav","source":"project-generated","rights":"project-original-demo","durationSeconds":12},"attribution":"Synthesized for Mood Drift Music by the project generator."},
    {"id":"storm-signal","title":"Storm Signal","artist":"Mood Drift Lab","genre":"pulse","bpm":138,"keyMidi":47,"mode":"minor","mood":{"valence":0.28,"arousal":0.91,"provenance":"design-proxy"},"audio":{"path":"audio/generated/storm-signal.wav","source":"project-generated","rights":"project-original-demo","durationSeconds":12},"attribution":"Synthesized for Mood Drift Music by the project generator."},
    {"id":"crossing-lines","title":"Crossing Lines","artist":"Mood Drift Lab","genre":"pulse","bpm":116,"keyMidi":50,"mode":"minor","mood":{"valence":0.42,"arousal":0.67,"provenance":"design-proxy"},"audio":{"path":"audio/generated/crossing-lines.wav","source":"project-generated","rights":"project-original-demo","durationSeconds":12},"attribution":"Synthesized for Mood Drift Music by the project generator."},
    {"id":"bright-motion","title":"Bright Motion","artist":"Mood Drift Lab","genre":"pulse","bpm":118,"keyMidi":60,"mode":"major","mood":{"valence":0.70,"arousal":0.68,"provenance":"design-proxy"},"audio":{"path":"audio/generated/bright-motion.wav","source":"project-generated","rights":"project-original-demo","durationSeconds":12},"attribution":"Synthesized for Mood Drift Music by the project generator."},
    {"id":"sunrise-run","title":"Sunrise Run","artist":"Mood Drift Lab","genre":"pulse","bpm":132,"keyMidi":62,"mode":"major","mood":{"valence":0.82,"arousal":0.82,"provenance":"design-proxy"},"audio":{"path":"audio/generated/sunrise-run.wav","source":"project-generated","rights":"project-original-demo","durationSeconds":12},"attribution":"Synthesized for Mood Drift Music by the project generator."},
    {"id":"golden-hour","title":"Golden Hour","artist":"Mood Drift Lab","genre":"pulse","bpm":144,"keyMidi":65,"mode":"major","mood":{"valence":0.92,"arousal":0.94,"provenance":"design-proxy"},"audio":{"path":"audio/generated/golden-hour.wav","source":"project-generated","rights":"project-original-demo","durationSeconds":12},"attribution":"Synthesized for Mood Drift Music by the project generator."}
  ]
}
